{
  "$schema":"../schemas/v1.6-review-record.schema.json",
  "schemaVersion":1,
  "recordId":"goreecloud.glaze-ui.v1.6.external-review",
  "lifecycle":"DevelopmentQualificationReview",
  "sourceRevision":"c7509c79256b04b0aa67cb9dd0737d7588e0ae4a",
  "acceptanceModelVersion":"1.6.0-dev.12",
  "toolingRevision":null,
  "environment":{
    "reviewedAt":null,
    "platform":null,
    "operatingSystem":null,
    "runtime":null,
    "representativeHardware":null,
    "formFactor":null,
    "displayContext":null,
    "inputModalities":[],
    "assistiveTechnologies":[]
  },
  "observations":[
    {"id":"accessibility","status":"pending","finding":null,"limitations":[],"evidenceRefs":[]},
    {"id":"reduced-motion","status":"pending","finding":null,"limitations":[],"evidenceRefs":[]},
    {"id":"reduced-transparency","status":"pending","finding":null,"limitations":[],"evidenceRefs":[]},
    {"id":"increased-contrast","status":"pending","finding":null,"limitations":[],"evidenceRefs":[]},
    {"id":"large-text","status":"pending","finding":null,"limitations":[],"evidenceRefs":[]},
    {"id":"keyboard-navigation","status":"pending","finding":null,"limitations":[],"evidenceRefs":[]},
    {"id":"assistive-technology","status":"pending","finding":null,"limitations":[],"evidenceRefs":[]},
    {"id":"responsive-layouts","status":"pending","finding":null,"limitations":[],"evidenceRefs":[]},
    {"id":"form-factor-transitions","status":"pending","finding":null,"limitations":[],"evidenceRefs":[]},
    {"id":"performance","status":"pending","finding":null,"limitations":[],"evidenceRefs":[]},
    {"id":"layout-stability","status":"pending","finding":null,"limitations":[],"evidenceRefs":[]},
    {"id":"privacy-boundaries","status":"pending","finding":null,"limitations":[],"evidenceRefs":[]},
    {"id":"authority-boundaries","status":"pending","finding":null,"limitations":[],"evidenceRefs":[]},
    {"id":"regression-testing","status":"pending","finding":null,"limitations":[],"evidenceRefs":[]},
    {"id":"representative-rendering","status":"pending","finding":null,"limitations":[],"evidenceRefs":[]}
  ],
  "evidence":[],
  "authority":{
    "humanAcceptanceGranted":false,
    "assistiveTechnologyAcceptanceGranted":false,
    "deviceAcceptanceGranted":false,
    "performanceAcceptanceGranted":false,
    "candidateStatusGranted":false,
    "releaseCandidateStatusGranted":false,
    "stableStatusGranted":false,
    "productionAcceptanceGranted":false
  },
  "notice":"Pending review template only. No observation, evidence reference, reviewer, approval, or acceptance result is populated automatically."
}
